{
  "fixture_pack_id": "RCA-F0.1-HOSTILE",
  "version": "F0.1",
  "standing": "RESEARCH_FALSIFICATION_FIXTURES",
  "runtime_effect": "NONE",
  "fixtures": [
    {
      "fixture_id": "RCA-H01",
      "title": "Same macro-label, different authorization",
      "attack_class": "FALSE_EQUIVALENCE",
      "target_record_refs": ["RCA-002", "RCA-007"],
      "construction": {
        "fine_case": "Two carriers both expose TRANSLATE, but only one has fresh scoped authority to bind an execution packet.",
        "coarse_case": "Both are labeled translation components.",
        "consequence": "Substitution changes whether the resulting packet may cross."
      },
      "violated_condition": "The coarse relation merges a pair outside the kernel of the authorization semantics.",
      "expected_disposition": "REJECT_CLOSURE",
      "proof_status": "COUNTEREXAMPLE_BY_CONSTRUCTION",
      "claim_ceiling": "Shared macro-function does not imply equivalence, substitution, or authority transfer."
    },
    {
      "fixture_id": "RCA-H02",
      "title": "Present-equivalent, future-distinct histories",
      "attack_class": "FUTURE_DISTINCTION",
      "target_record_refs": ["RCA-009"],
      "construction": {
        "fine_case": "States x0 and x1 have the same current projection; continuation reveal emits 0 from x0 and 1 from x1.",
        "coarse_case": "alpha(x0) = alpha(x1).",
        "consequence": "The continuation semantics distinguishes the fiber members."
      },
      "violated_condition": "Current observation equality is not congruence under the admitted continuation family.",
      "expected_disposition": "REFINE_OR_REOPEN",
      "proof_status": "COUNTEREXAMPLE_BY_CONSTRUCTION",
      "claim_ceiling": "The view is inadequate for any action family containing reveal."
    },
    {
      "fixture_id": "RCA-H03",
      "title": "Joint dependence missed by local sensitivity",
      "attack_class": "JOINT_DEPENDENCE",
      "target_record_refs": ["RCA-009"],
      "construction": {
        "fine_case": "For action a(b1,b2)=b1 AND b2 at state (0,0), changing either bit alone preserves 0 while changing both produces 1.",
        "coarse_case": "A field-local scan marks both bits individually nonmaterial.",
        "consequence": "The joint fiber contains different action results."
      },
      "violated_condition": "Materiality was tested coordinate-by-coordinate rather than over the complete abstraction fiber.",
      "expected_disposition": "REJECT_CLOSURE",
      "proof_status": "COUNTEREXAMPLE_BY_CONSTRUCTION",
      "claim_ceiling": "Local sensitivity is not a complete adequacy test."
    },
    {
      "fixture_id": "RCA-H04",
      "title": "Same members, different wiring",
      "attack_class": "COMPOSITION_ORDER",
      "target_record_refs": ["RCA-002", "RCA-005"],
      "construction": {
        "fine_case": "Assembly one executes Sanitize then Send; assembly two executes Send then Sanitize.",
        "coarse_case": "Both assemblies contain the same two member names.",
        "consequence": "One protects the payload; the other discloses the unsanitized payload."
      },
      "violated_condition": "Membership was retained while order, interfaces, and hidden channels were suppressed.",
      "expected_disposition": "REJECT_CLOSURE",
      "proof_status": "COUNTEREXAMPLE_BY_CONSTRUCTION",
      "claim_ceiling": "A compositional witness must retain wiring and boundary assumptions, not only members."
    },
    {
      "fixture_id": "RCA-H05",
      "title": "Profile drift invalidates prior adequacy",
      "attack_class": "PROFILE_DRIFT",
      "target_record_refs": ["RCA-008", "RCA-009"],
      "construction": {
        "fine_case": "A jurisdiction distinction is irrelevant under K0 and becomes required under K1.",
        "coarse_case": "A K0 certificate is reused after the profile changes to K1.",
        "consequence": "The same macro-view now permits a result that differs across its hidden jurisdiction states."
      },
      "violated_condition": "The certificate is not atomically bound to the current profile version and action family.",
      "expected_disposition": "HOLD",
      "proof_status": "COUNTEREXAMPLE_BY_CONSTRUCTION",
      "claim_ceiling": "Profile change must invalidate or reprove every affected adequacy certificate."
    },
    {
      "fixture_id": "RCA-H06",
      "title": "Approved abstraction, mutated final action",
      "attack_class": "EXACT_ACTION_MUTATION",
      "target_record_refs": ["RCA-005"],
      "construction": {
        "fine_case": "Approval is bound to send(amount=10); an agent transformation produces final dispatch send(amount=100).",
        "coarse_case": "Both route states retain the same original approval hash and macro-label APPROVED.",
        "consequence": "The final external effect differs although the coarse approval view is unchanged."
      },
      "violated_condition": "The exact final tool identity and canonical arguments are absent from the approval-bound semantics.",
      "expected_disposition": "HOLD",
      "proof_status": "STATIC_ANALYSIS",
      "source_refs": [
        "rio-proxy@70945d1f037915f132dba0a1418a42103606e63a",
        "bodyunity RUN-024@fd414de63689649dc17e7d5178406d92c79ca1a1"
      ],
      "claim_ceiling": "The inspected route is nonconformant at the exact-action seam; no unauthorized effect is asserted to have occurred."
    },
    {
      "fixture_id": "RCA-H07",
      "title": "Hidden change with no active reopen trigger",
      "attack_class": "TRIGGER_FAILURE",
      "target_record_refs": ["RCA-001", "RCA-009", "RCA-012"],
      "construction": {
        "fine_case": "A grant contains a hidden expiry time and is summarized only as VALID.",
        "coarse_case": "Time advances beyond expiry without an event visible to the coarse state.",
        "consequence": "The next use remains marked VALID even though its fine semantics changed."
      },
      "violated_condition": "A witness exists, but no active invalidation metadata can detect when adequacy ceases.",
      "expected_disposition": "HOLD",
      "proof_status": "COUNTEREXAMPLE_BY_CONSTRUCTION",
      "claim_ceiling": "Reopenability needs trigger completeness, not merely stored fine data."
    },
    {
      "fixture_id": "RCA-H08",
      "title": "Overlapping cover amplifies a single grant",
      "attack_class": "OVERLAP_AMPLIFICATION",
      "target_record_refs": ["RCA-008"],
      "construction": {
        "fine_case": "One authority grant participates through different role slices in two macro-functions.",
        "coarse_case": "An aggregator counts each participation as an independent grant.",
        "consequence": "The effective authority or quota is doubled."
      },
      "violated_condition": "Overlapping functional participation duplicated identity, authority, or quota.",
      "expected_disposition": "REJECT_AMPLIFICATION",
      "proof_status": "COUNTEREXAMPLE_BY_CONSTRUCTION",
      "claim_ceiling": "A hypergraph permits overlap but must preserve shared resource identity."
    },
    {
      "fixture_id": "RCA-H09",
      "title": "Pairwise-compatible views with no global realization",
      "attack_class": "LOCAL_GLOBAL_INCOMPATIBILITY",
      "target_record_refs": ["RCA-003", "RCA-008"],
      "construction": {
        "fine_case": "Binary variables satisfy local reports x!=y, y!=z, and z!=x.",
        "coarse_case": "Every pairwise report is individually well-formed.",
        "consequence": "No binary global state realizes all three reports."
      },
      "violated_condition": "Local well-formedness and pairwise overlap were mistaken for global compatibility.",
      "expected_disposition": "HOLD",
      "proof_status": "COUNTEREXAMPLE_BY_CONSTRUCTION",
      "claim_ceiling": "A functional cover needs explicit compatibility semantics; incidence alone does not establish a whole."
    },
    {
      "fixture_id": "RCA-H10",
      "title": "Mixed operations do not commute",
      "attack_class": "MIXED_NONCOMMUTATION",
      "target_record_refs": ["RCA-008"],
      "construction": {
        "fine_case": "Two body-member returns jointly expose an XOR conflict that changes the whole-body posture.",
        "coarse_case": "Projecting each local return to a constant before composing erases the conflict; composing fine returns first and then projecting the posture preserves it.",
        "consequence": "Equivalence abstraction followed by composition differs from composition followed by abstraction."
      },
      "violated_condition": "Equivalence projection and compositional assembly were assumed to commute without proof.",
      "expected_disposition": "REJECT_CLOSURE",
      "proof_status": "COUNTEREXAMPLE_BY_CONSTRUCTION",
      "claim_ceiling": "The order and type of every closure operation are material unless commutation is proved."
    },
    {
      "fixture_id": "RCA-H11",
      "title": "Shared morphology launders semantic inversion",
      "attack_class": "MORPHOLOGY_LAUNDERING",
      "target_record_refs": ["RCA-006", "RCA-007", "RCA-010", "RCA-011"],
      "construction": {
        "fine_case": "Sanitization and exfiltration both instantiate read -> transform -> write; a mirrored substitution may also preserve visible bilateral form.",
        "coarse_case": "The systems share a transformation or symmetry signature.",
        "consequence": "One protects data while the other discloses it; one symmetric corruption remains undetected."
      },
      "violated_condition": "Morphological recurrence was promoted into equivalence, authority, or a fault-detection guarantee.",
      "expected_disposition": "MORPHOLOGICAL_CANDIDATE_ONLY",
      "proof_status": "COUNTEREXAMPLE_BY_CONSTRUCTION",
      "claim_ceiling": "A shared form supports comparison only until independent semantics or a detection bound is supplied."
    },
    {
      "fixture_id": "RCA-H12",
      "title": "Lawful reopening is blocked by privacy or deletion",